ev_opencl_v0.0309.log
{"input": ["ev_opencl -keys=ev_opencl,gpu -max_num_threads=64", "conv2d_nhwc.ev_opencl", [["TENSOR", [1, 225, 225, 3], "uint8"], ["TENSOR", [3, 3, 3, 32], "uint8"], [2, 2], [0, 0, 0, 0], [1, 1], "int32"], {}], "config": {"index": 6, "code_hash": null, "entity": [["tile_c", "ot", 16], ["num_thread_c", "ot", 64], ["vthread_c", "ot", 1], ["step", "ot", 64]]}, "result": [1.5824e-05, 0, 0, 0], "version": 0.2, "tvm_version": "0.7.dev1"}
{"input": ["ev_opencl -keys=ev_opencl,gpu -max_num_threads=64", "conv2d_nhwc.ev_opencl", [["TENSOR", [1, 112, 112, 32], "uint8"], ["TENSOR", [1, 1, 32, 16], "uint8"], [1, 1], [0, 0, 0, 0], [1, 1], "int32"], {}], "config": {"index": 2, "code_hash": null, "entity": [["tile_c", "ot", 16], ["num_thread_c", "ot", 64], ["vthread_c", "ot", 1], ["step", "ot", 3]]}, "result": [1.7105e-05, 0, 0, 0], "version": 0.2, "tvm_version": "0.7.dev1"}
{"input": ["ev_opencl -keys=ev_opencl,gpu -max_num_threads=64", "conv2d_nhwc.ev_opencl", [["TENSOR", [1, 56, 56, 96], "uint8"], ["TENSOR", [1, 1, 96, 24], "uint8"], [1, 1], [0, 0, 0, 0], [1, 1], "int32"], {}], "config": {"index": 0, "code_hash": null, "entity": [["tile_c", "ot", 16], ["num_thread_c", "ot", 64], ["vthread_c", "ot", 1], ["step", "ot", 16]]}, "result": [1.8102e-05, 0, 0, 0], "version": 0.2, "tvm_version": "0.7.dev1"}
{"input": ["ev_opencl -keys=ev_opencl,gpu -max_num_threads=64", "conv2d_nhwc.ev_opencl", [["TENSOR", [1, 56, 56, 144], "uint8"], ["TENSOR", [1, 1, 144, 24], "uint8"], [1, 1], [0, 0, 0, 0], [1, 1], "int32"], {}], "config": {"index": 2, "code_hash": null, "entity": [["tile_c", "ot", 16], ["num_thread_c", "ot", 64], ["vthread_c", "ot", 1], ["step", "ot", 3]]}, "result": [1.7142e-05, 0, 0, 0], "version": 0.2, "tvm_version": "0.7.dev1"}
{"input": ["ev_opencl -keys=ev_opencl,gpu -max_num_threads=64", "conv2d_nhwc.ev_opencl", [["TENSOR", [1, 56, 56, 24], "uint8"], ["TENSOR", [1, 1, 24, 144], "uint8"], [1, 1], [0, 0, 0, 0], [1, 1], "int32"], {}], "config": {"index": 4, "code_hash": null, "entity": [["tile_c", "ot", 16], ["num_thread_c", "ot", 64], ["vthread_c", "ot", 1], ["step", "ot", 32]]}, "result": [1.6458e-05, 0, 0, 0], "version": 0.2, "tvm_version": "0.7.dev1"}
{"input": ["ev_opencl -keys=ev_opencl,gpu -max_num_threads=64", "conv2d_nhwc.ev_opencl", [["TENSOR", [1, 28, 28, 144], "uint8"], ["TENSOR", [1, 1, 144, 32], "uint8"], [1, 1], [0, 0, 0, 0], [1, 1], "int32"], {}], "config": {"index": 2, "code_hash": null, "entity": [["tile_c", "ot", 16], ["num_thread_c", "ot", 64], ["vthread_c", "ot", 1], ["step", "ot", 3]]}, "result": [8.605e-06, 0, 0, 0], "version": 0.2, "tvm_version": "0.7.dev1"}
{"input": ["ev_opencl -keys=ev_opencl,gpu -max_num_threads=64", "conv2d_nhwc.ev_opencl", [["TENSOR", [1, 28, 28, 192], "uint8"], ["TENSOR", [1, 1, 192, 32], "uint8"], [1, 1], [0, 0, 0, 0], [1, 1], "int32"], {}], "config": {"index": 2, "code_hash": null, "entity": [["tile_c", "ot", 16], ["num_thread_c", "ot", 64], ["vthread_c", "ot", 1], ["step", "ot", 3]]}, "result": [1.095e-05, 0, 0, 0], "version": 0.2, "tvm_version": "0.7.dev1"}
{"input": ["ev_opencl -keys=ev_opencl,gpu -max_num_threads=64", "conv2d_nhwc.ev_opencl", [["TENSOR", [1, 28, 28, 32], "uint8"], ["TENSOR", [1, 1, 32, 192], "uint8"], [1, 1], [0, 0, 0, 0], [1, 1], "int32"], {}], "config": {"index": 2, "code_hash": null, "entity": [["tile_c", "ot", 16], ["num_thread_c", "ot", 64], ["vthread_c", "ot", 1], ["step", "ot", 3]]}, "result": [9.249e-06, 0, 0, 0], "version": 0.2, "tvm_version": "0.7.dev1"}
{"input": ["ev_opencl -keys=ev_opencl,gpu -max_num_threads=64", "conv2d_nhwc.ev_opencl", [["TENSOR", [1, 14, 14, 192], "uint8"], ["TENSOR", [1, 1, 192, 64], "uint8"], [1, 1], [0, 0, 0, 0], [1, 1], "int32"], {}], "config": {"index": 2, "code_hash": null, "entity": [["tile_c", "ot", 16], ["num_thread_c", "ot", 64], ["vthread_c", "ot", 1], ["step", "ot", 3]]}, "result": [7.306e-06, 0, 0, 0], "version": 0.2, "tvm_version": "0.7.dev1"}
{"input": ["ev_opencl -keys=ev_opencl,gpu -max_num_threads=64", "conv2d_nhwc.ev_opencl", [["TENSOR", [1, 14, 14, 384], "uint8"], ["TENSOR", [1, 1, 384, 64], "uint8"], [1, 1], [0, 0, 0, 0], [1, 1], "int32"], {}], "config": {"index": 2, "code_hash": null, "entity": [["tile_c", "ot", 16], ["num_thread_c", "ot", 64], ["vthread_c", "ot", 1], ["step", "ot", 3]]}, "result": [9.531e-06, 0, 0, 0], "version": 0.2, "tvm_version": "0.7.dev1"}
{"input": ["ev_opencl -keys=ev_opencl,gpu -max_num_threads=64", "conv2d_nhwc.ev_opencl", [["TENSOR", [1, 14, 14, 64], "uint8"], ["TENSOR", [1, 1, 64, 384], "uint8"], [1, 1], [0, 0, 0, 0], [1, 1], "int32"], {}], "config": {"index": 2, "code_hash": null, "entity": [["tile_c", "ot", 16], ["num_thread_c", "ot", 64], ["vthread_c", "ot", 1], ["step", "ot", 3]]}, "result": [8.423e-06, 0, 0, 0], "version": 0.2, "tvm_version": "0.7.dev1"}
{"input": ["ev_opencl -keys=ev_opencl,gpu -max_num_threads=64", "conv2d_nhwc.ev_opencl", [["TENSOR", [1, 14, 14, 384], "uint8"], ["TENSOR", [1, 1, 384, 96], "uint8"], [1, 1], [0, 0, 0, 0], [1, 1], "int32"], {}], "config": {"index": 2, "code_hash": null, "entity": [["tile_c", "ot", 16], ["num_thread_c", "ot", 64], ["vthread_c", "ot", 1], ["step", "ot", 3]]}, "result": [9.86e-06, 0, 0, 0], "version": 0.2, "tvm_version": "0.7.dev1"}
{"input": ["ev_opencl -keys=ev_opencl,gpu -max_num_threads=64", "conv2d_nhwc.ev_opencl", [["TENSOR", [1, 14, 14, 576], "uint8"], ["TENSOR", [1, 1, 576, 96], "uint8"], [1, 1], [0, 0, 0, 0], [1, 1], "int32"], {}], "config": {"index": 2, "code_hash": null, "entity": [["tile_c", "ot", 16], ["num_thread_c", "ot", 64], ["vthread_c", "ot", 1], ["step", "ot", 3]]}, "result": [9.447e-06, 0, 0, 0], "version": 0.2, "tvm_version": "0.7.dev1"}
{"input": ["ev_opencl -keys=ev_opencl,gpu -max_num_threads=64", "conv2d_nhwc.ev_opencl", [["TENSOR", [1, 14, 14, 96], "uint8"], ["TENSOR", [1, 1, 96, 576], "uint8"], [1, 1], [0, 0, 0, 0], [1, 1], "int32"], {}], "config": {"index": 4, "code_hash": null, "entity": [["tile_c", "ot", 16], ["num_thread_c", "ot", 64], ["vthread_c", "ot", 1], ["step", "ot", 32]]}, "result": [1.1344e-05, 0, 0, 0], "version": 0.2, "tvm_version": "0.7.dev1"}
{"input": ["ev_opencl -keys=ev_opencl,gpu -max_num_threads=64", "conv2d_nhwc.ev_opencl", [["TENSOR", [1, 7, 7, 576], "uint8"], ["TENSOR", [1, 1, 576, 160], "uint8"], [1, 1], [0, 0, 0, 0], [1, 1], "int32"], {}], "config": {"index": 2, "code_hash": null, "entity": [["tile_c", "ot", 16], ["num_thread_c", "ot", 64], ["vthread_c", "ot", 1], ["step", "ot", 3]]}, "result": [8.734e-06, 0, 0, 0], "version": 0.2, "tvm_version": "0.7.dev1"}
{"input": ["ev_opencl -keys=ev_opencl,gpu -max_num_threads=64", "conv2d_nhwc.ev_opencl", [["TENSOR", [1, 7, 7, 960], "uint8"], ["TENSOR", [1, 1, 960, 160], "uint8"], [1, 1], [0, 0, 0, 0], [1, 1], "int32"], {}], "config": {"index": 2, "code_hash": null, "entity": [["tile_c", "ot", 16], ["num_thread_c", "ot", 64], ["vthread_c", "ot", 1], ["step", "ot", 3]]}, "result": [9.874e-06, 0, 0, 0], "version": 0.2, "tvm_version": "0.7.dev1"}
{"input": ["ev_opencl -keys=ev_opencl,gpu -max_num_threads=64", "conv2d_nhwc.ev_opencl", [["TENSOR", [1, 7, 7, 160], "uint8"], ["TENSOR", [1, 1, 160, 960], "uint8"], [1, 1], [0, 0, 0, 0], [1, 1], "int32"], {}], "config": {"index": 4, "code_hash": null, "entity": [["tile_c", "ot", 16], ["num_thread_c", "ot", 64], ["vthread_c", "ot", 1], ["step", "ot", 32]]}, "result": [1.4255e-05, 0, 0, 0], "version": 0.2, "tvm_version": "0.7.dev1"}
{"input": ["ev_opencl -keys=ev_opencl,gpu -max_num_threads=64", "conv2d_nhwc.ev_opencl", [["TENSOR", [1, 7, 7, 960], "uint8"], ["TENSOR", [1, 1, 960, 320], "uint8"], [1, 1], [0, 0, 0, 0], [1, 1], "int32"], {}], "config": {"index": 2, "code_hash": null, "entity": [["tile_c", "ot", 16], ["num_thread_c", "ot", 64], ["vthread_c", "ot", 1], ["step", "ot", 3]]}, "result": [1.3306e-05, 0, 0, 0], "version": 0.2, "tvm_version": "0.7.dev1"}
{"input": ["ev_opencl -keys=ev_opencl,gpu -max_num_threads=64", "conv2d_nhwc.ev_opencl", [["TENSOR", [1, 7, 7, 320], "uint8"], ["TENSOR", [1, 1, 320, 1280], "uint8"], [1, 1], [0, 0, 0, 0], [1, 1], "int32"], {}], "config": {"index": 1, "code_hash": null, "entity": [["tile_c", "ot", 32], ["num_thread_c", "ot", 64], ["vthread_c", "ot", 1], ["step", "ot", 16]]}, "result": [3.2658e-05, 0, 0, 0], "version": 0.2, "tvm_version": "0.7.dev1"}
{"input": ["ev_opencl -keys=ev_opencl,gpu -max_num_threads=64", "conv2d_nhwc.ev_opencl", [["TENSOR", [1, 112, 112, 16], "uint8"], ["TENSOR", [1, 1, 16, 96], "uint8"], [1, 1], [0, 0, 0, 0], [1, 1], "int32"], {}], "config": {"index": 0, "code_hash": null, "entity": []}, "result": [9.0461e-05, 0, 0, 0], "version": 0.2, "tvm_version": "0.7.dev1"}
{"input": ["ev_opencl -keys=ev_opencl,gpu -max_num_threads=64", "conv2d_nhwc.ev_opencl", [["TENSOR", [1, 1, 1, 1280], "uint8"], ["TENSOR", [1, 1, 1280, 1001], "uint8"], [1, 1], [0, 0, 0, 0], [1, 1], "int32"], {}], "config": {"index": 0, "code_hash": null, "entity": []}, "result": [3.8791e-05, 0, 0, 0], "version": 0.2, "tvm_version": "0.7.dev1"}

